{
  "aggregate": {
    "alert": null,
    "services_exhausted": 0,
    "services_healthy": 0,
    "services_total": 5,
    "services_warning": 0
  },
  "computed_at": "2026-09-01T17:51:53.939057+00:00",
  "services": {
    "ai-whisperers.org": {
      "availability_pct": 0.0,
      "budget_status": "unknown",
      "error_budget_remaining_pct": 100.0,
      "error_budget_used_pct": 0.0,
      "last_check_at": "2026-09-01T17:51:53.938274+00:00",
      "latency_p95_ms": null,
      "samples": 0,
      "slo_availability": 0.99,
      "slo_latency_p95_ms": 1000,
      "window_days": 28
    },
    "el-gato-siames": {
      "availability_pct": 0.0,
      "budget_status": "unknown",
      "error_budget_remaining_pct": 100.0,
      "error_budget_used_pct": 0.0,
      "last_check_at": "2026-09-01T17:51:53.938277+00:00",
      "latency_p95_ms": null,
      "samples": 0,
      "slo_availability": 0.99,
      "slo_latency_p95_ms": 1000,
      "window_days": 28
    },
    "nexaparaguay.com.py": {
      "availability_pct": 0.0,
      "budget_status": "unknown",
      "error_budget_remaining_pct": 100.0,
      "error_budget_used_pct": 0.0,
      "last_check_at": "2026-09-01T17:51:53.938259+00:00",
      "latency_p95_ms": null,
      "samples": 0,
      "slo_availability": 0.999,
      "slo_latency_p95_ms": 500,
      "window_days": 28
    },
    "ometzdental.com": {
      "availability_pct": 0.0,
      "budget_status": "unknown",
      "error_budget_remaining_pct": 100.0,
      "error_budget_used_pct": 0.0,
      "last_check_at": "2026-09-01T17:51:53.938271+00:00",
      "latency_p95_ms": null,
      "samples": 0,
      "slo_availability": 0.999,
      "slo_latency_p95_ms": 500,
      "window_days": 28
    },
    "refugio-animal-paraguay": {
      "availability_pct": 0.0,
      "budget_status": "unknown",
      "error_budget_remaining_pct": 100.0,
      "error_budget_used_pct": 0.0,
      "last_check_at": "2026-09-01T17:51:53.939049+00:00",
      "latency_p95_ms": null,
      "samples": 0,
      "slo_availability": 0.99,
      "slo_latency_p95_ms": 1000,
      "window_days": 28
    }
  },
  "version": "1.0.0"
}
